{
  "schema_version": "1.0.0",
  "iteration_id": "phase1-benchmark-iteration-04",
  "source_commit": "a29dd8a4bc690c734f02b4312149f7b296dd74ba",
  "created_at": "2026-09-06T11:47:00+07:00",
  "process": {
    "objective": "Implement the Deep Research benchmark recommendations as the Benchmark V1 architecture freeze before collecting real owner pilot, calibration, or sequestered evidence.",
    "decisions": [
      {
        "id": "I04-D01",
        "area": "construct and primary signal",
        "change": "Frozen OWNER_PRODUCT_FIT as the V1 construct and made blind holistic owner preference the primary signal: A | B | TIE | BOTH_FAIL | UNCERTAIN plus confidence.",
        "declared_reason": "Deep Research concluded that the immediate target is the owner's product preference, not AI quality, general-audience preference, FoC similarity, or a weighted rubric score.",
        "basis": ["Deep Research report supplied by the product owner on 2026-09-06", "docs/phase1/ITERATION-04-WORK-ORDER.md"],
        "expected_effect": "Prevent rubric or judge proxies from silently redefining what counts as improvement.",
        "status": "APPLIED"
      },
      {
        "id": "I04-D02",
        "area": "preference-first isolation",
        "change": "Separated first-pass preference from post-vote diagnostics. Owner packets now contain only neutral context, A/B prose, verdict options, confidence, freeze rule, and a reference to a separately gated post-vote artifact.",
        "declared_reason": "Static review found that embedding diagnostic prompts in the same raw packet could still prime the owner even if the protocol said they should be hidden until after voting.",
        "basis": ["Deep Research taxonomy-after-vote recommendation", "benchmarks/p01/calibration/post-vote-owner-diagnostics.json"],
        "expected_effect": "Enforce preference-before-diagnosis at the data boundary rather than relying only on operator discipline.",
        "status": "REVISED"
      },
      {
        "id": "I04-D03",
        "area": "failure observability",
        "change": "Created a standalone failure-signature contract with SPAN | MULTI_SPAN | UNIT_GLOBAL scope, RESOLVED | UNRESOLVED state, one primary family, contributes_to, and root_cause constrained to null.",
        "declared_reason": "The benchmark must create a clean output-side failure node for later white-box tracing without prematurely blaming Planner, Writer, Evidence, or another module.",
        "basis": ["Deep Research failure-signature recommendation", "schemas/failure-signature.schema.json"],
        "expected_effect": "Make output failures traceable while keeping root-cause attribution downstream.",
        "status": "APPLIED"
      },
      {
        "id": "I04-D04",
        "area": "taxonomy",
        "change": "Frozen a six-family Product taxonomy: NARRATIVE_FUNCTION, EXPOSITION_LOAD, SPOKEN_COMPREHENSION, GROUNDING_SPECIFICITY, VOICE_STANCE, REDUNDANCY, with anti-double-counting rules.",
        "declared_reason": "The previous dimension/defect vocabulary could double-count the same symptom and treat essay-like behavior as several supposedly independent failures.",
        "basis": ["Deep Research minimal taxonomy recommendation", "benchmarks/p01/taxonomy.json"],
        "expected_effect": "Keep diagnostics small, observable, and suitable for binary fault isolation later.",
        "status": "APPLIED"
      },
      {
        "id": "I04-D05",
        "area": "evaluation granularity",
        "change": "Introduced eval_unit as the benchmark primitive with historical_topic, editorial_function, granularity, modality, and evidence_condition; granularities are FUNCTION_CLIP, SECTION_SENTINEL, EPISODE_SENTINEL.",
        "declared_reason": "Clip-only optimization can Goodhart locally while degrading section or episode flow, and evaluation units should be editorial-function based rather than fixed word-count based.",
        "basis": ["Deep Research evaluation-unit recommendation", "schemas/eval-unit.schema.json"],
        "expected_effect": "Support function/topic/granularity slices and later macro sentinels.",
        "status": "APPLIED"
      },
      {
        "id": "I04-D06",
        "area": "truth and spoken evidence",
        "change": "Strengthened claim-level Truth semantics with implied-premise/causal claim types, verifiability, source relation, materiality and release blockers; created an independent Spoken lane for TEXT_PREDICTION, AUDIO_OBSERVATION, and LISTENER_REPORT.",
        "declared_reason": "Round-01 truth review overapproved hidden premises and causal claims, while text-only listenability judgments were being asked to stand in for actual listening evidence.",
        "basis": ["Deep Research factuality and spoken-evidence recommendations", "schemas/truth-gate.schema.json", "schemas/spoken-observation.schema.json"],
        "expected_effect": "Make factual and spoken claims match the evidence actually available without suppressing Product preference measurement.",
        "status": "APPLIED"
      },
      {
        "id": "I04-D07",
        "area": "dataset validity",
        "change": "Demoted every historical/public P01 sample to DEV, converted the three existing owner pairs to PILOT, and replaced public HOLDOUT semantics with a private/restricted SEQUESTERED lifecycle plus REFRESHED_SEQUESTERED after tuning exposure.",
        "declared_reason": "Historical P01 material has been repeatedly exposed during harness/evaluator design and cannot provide blind validity evidence; a public repository cannot contain a genuinely sequestered payload and labels.",
        "basis": ["Deep Research dataset lifecycle recommendation", "benchmarks/p01/benchmark-set.json", "benchmarks/p01/sequestered-manifest.json"],
        "expected_effect": "Prevent contaminated development material from being mistaken for out-of-sample validation.",
        "status": "APPLIED"
      },
      {
        "id": "I04-D08",
        "area": "judge and reference authority",
        "change": "Formalized LLM judges as SHADOW_ONLY until out-of-sample owner validation passes pre-registered reliability gates; kept FoC hidden during primary preference and available only for post-vote functional target-gap analysis; removed global score, Elo, and Bradley-Terry requirements from V1.",
        "declared_reason": "Deep Research found substantial judge bias risk and warned that reference visibility and small-sample ranking models can create anchoring or false precision.",
        "basis": ["Deep Research LLM-judge, reference-bias, and aggregation recommendations", "schemas/judge-reliability.schema.json", "schemas/target-gap.schema.json"],
        "expected_effect": "Keep proxy evaluators and craft references subordinate to the owner/product construct until independently validated.",
        "status": "APPLIED"
      }
    ],
    "implementation_steps": [
      {
        "seq": 1,
        "action": "Frozen Iteration 04 work order on a safety sub-branch before edits.",
        "files": ["docs/phase1/ITERATION-04-WORK-ORDER.md"],
        "observed_result": "Deep Research recommendations became bounded implementation requirements before architecture changes began."
      },
      {
        "seq": 2,
        "action": "Split benchmark responsibilities into standalone evaluation schemas and deprecated the monolithic output-quality schema.",
        "files": ["schemas/eval-unit.schema.json", "schemas/pairwise-preference.schema.json", "schemas/failure-signature.schema.json", "schemas/truth-gate.schema.json", "schemas/spoken-observation.schema.json", "schemas/target-gap.schema.json", "schemas/judge-reliability.schema.json", "schemas/output-quality.schema.json"],
        "observed_result": "Product preference, diagnostics, Truth, Spoken, Target Gap, and judge reliability no longer share one evaluator object."
      },
      {
        "seq": 3,
        "action": "Frozen six-family Product taxonomy and added an explicit pilot evaluation unit.",
        "files": ["benchmarks/p01/taxonomy.json", "benchmarks/p01/eval-units/eu-p01-pilot-mechanism-01.json"],
        "observed_result": "Diagnostics now support macro scope, one primary family, unresolved classification, and no upstream root-cause claim."
      },
      {
        "seq": 4,
        "action": "Reclassified all shared/public historical P01 evidence as DEV and rewrote source roles accordingly.",
        "files": ["benchmarks/p01/benchmark-set.json", "benchmarks/p01/source-manifest.json"],
        "observed_result": "The former calibration candidates and former HOLDOUT are explicitly exposed DEV material."
      },
      {
        "seq": 5,
        "action": "Added public sequestered metadata shell and initialized an unvalidated shadow-judge state.",
        "files": ["benchmarks/p01/sequestered-manifest.json", "benchmarks/p01/judge-reliability.json"],
        "observed_result": "No private validation prose or labels are represented as present in the public repository; judge has no optimization authority."
      },
      {
        "seq": 6,
        "action": "Converted the three historical owner pairs to pilot-only preference packets with BOTH_FAIL, confidence and freeze semantics.",
        "files": ["benchmarks/p01/owner-calibration.json", "benchmarks/p01/calibration/dispatch-map.json", "benchmarks/p01/calibration/owner-packets/owner-cal-01.json", "benchmarks/p01/calibration/owner-packets/owner-cal-02.json", "benchmarks/p01/calibration/owner-packets/owner-cal-03.json"],
        "observed_result": "Current pairs test protocol usability only and cannot be used as benchmark-validity evidence."
      },
      {
        "seq": 7,
        "action": "Static review found pre-vote priming risk because optional diagnostic prompts were still embedded in the same raw owner packet; moved them to a separately gated post-vote artifact and tightened verifier checks.",